{
  "id": "dining-table-1800",
  "name": "Стол обеденный 1800",
  "category": "tables_chairs",
  "file": "assets/models/zamer_catalog/dining-table-1800.glb",
  "dimensions_m": {
    "width": 1.8,
    "depth": 0.9,
    "height": 0.76
  },
  "placement": "floor",
  "pivot": "floor_center",
  "lod": {
    "lod0_triangles": 2476,
    "lod1_file": "assets/models/zamer_catalog/dining-table-1800_lod1.glb",
    "lod1_triangles": 1036,
    "lod2_file": "assets/models/zamer_catalog/dining-table-1800_lod2.glb",
    "lod2_triangles": 424
  },
  "materials": {
    "pbr": true,
    "max_texture_size": 2048,
    "material_count": 2
  },
  "collision": {
    "type": "box",
    "file": null
  },
  "source": {
    "generator": "zamer-procedural-furniture-v1",
    "license": "project-generated",
    "reference": "internal"
  },
  "version": 1
}
