{
  "id": "table-round",
  "name": "Стол круглый",
  "category": "tables_chairs",
  "file": "assets/models/zamer_catalog/table-round.glb",
  "dimensions_m": {
    "width": 1.1,
    "depth": 1.1,
    "height": 0.76
  },
  "placement": "floor",
  "pivot": "floor_center",
  "lod": {
    "lod0_triangles": 512,
    "lod1_file": "assets/models/zamer_catalog/table-round_lod1.glb",
    "lod1_triangles": 320,
    "lod2_file": "assets/models/zamer_catalog/table-round_lod2.glb",
    "lod2_triangles": 256
  },
  "materials": {
    "pbr": true,
    "max_texture_size": 2048,
    "material_count": 2
  },
  "collision": {
    "type": "box",
    "file": null
  },
  "source": {
    "generator": "zamer-procedural-furniture-v2",
    "license": "project-generated",
    "reference": "internal"
  },
  "version": 1
}
