{
  "id": "dresser-1200",
  "name": "Комод 1200",
  "category": "storage",
  "file": "assets/models/zamer_catalog/dresser-1200.glb",
  "dimensions_m": {
    "width": 1.2,
    "depth": 0.5,
    "height": 0.95
  },
  "placement": "floor",
  "pivot": "floor_center",
  "lod": {
    "lod0_triangles": 1168,
    "lod1_file": "assets/models/zamer_catalog/dresser-1200_lod1.glb",
    "lod1_triangles": 648,
    "lod2_file": "assets/models/zamer_catalog/dresser-1200_lod2.glb",
    "lod2_triangles": 504
  },
  "materials": {
    "pbr": true,
    "max_texture_size": 2048,
    "material_count": 3
  },
  "collision": {
    "type": "box",
    "file": null
  },
  "source": {
    "generator": "zamer-procedural-furniture-v2",
    "license": "project-generated",
    "reference": "internal"
  },
  "version": 1
}
