{
  "id": "sofa-2",
  "name": "Диван 2-местный",
  "category": "soft_furniture",
  "file": "assets/models/zamer_catalog/sofa-2.glb",
  "dimensions_m": {
    "width": 1.75,
    "depth": 0.9,
    "height": 0.86
  },
  "placement": "floor",
  "pivot": "floor_center",
  "lod": {
    "lod0_triangles": 12876,
    "lod1_file": "assets/models/zamer_catalog/sofa-2_lod1.glb",
    "lod1_triangles": 4876,
    "lod2_file": "assets/models/zamer_catalog/sofa-2_lod2.glb",
    "lod2_triangles": 1684
  },
  "materials": {
    "pbr": true,
    "max_texture_size": 2048,
    "material_count": 3
  },
  "collision": {
    "type": "box",
    "file": null
  },
  "source": {
    "generator": "zamer-procedural-furniture-v2",
    "license": "project-generated",
    "reference": "internal"
  },
  "version": 1
}
