{
  "id": "sofa_001",
  "name": "Sofa 001",
  "category": "soft_furniture",
  "file": "assets/models/zamer_catalog/sofa_001.glb",
  "preview": "assets/models/previews/sofa_001.webp",
  "dimensions_m": {
    "width": 2.2,
    "depth": 0.95,
    "height": 0.82
  },
  "placement": "floor",
  "pivot": "floor_center",
  "lod": {
    "lod0_triangles": 32000,
    "lod1_file": "assets/models/zamer_catalog/sofa_001_lod1.glb",
    "lod1_triangles": 16000,
    "lod2_file": "assets/models/zamer_catalog/sofa_001_lod2.glb",
    "lod2_triangles": 7000
  },
  "materials": {
    "pbr": true,
    "max_texture_size": 2048,
    "material_count": 2
  },
  "collision": {
    "type": "convex",
    "file": null
  },
  "source": {
    "generator": "image-to-3d",
    "license": "verify-before-release",
    "reference": ""
  },
  "version": 1
}
